,page_link,page_header,page_text_content,link_text
Whenever necessary, the Administration shall coordinate with other appropriate entities in the implementation of said programs. (Section 3, Rule I, Part V, Ibid.).

SECTION 4.    Legal Assistance. â€” The Administration shall provide free legal assistance to victims of illegal recruitment and related cases including but not limited to legal advice, assistance in the preparation of complaints and supporting documents, institution of criminal actions and whenever necessary, provide counseling assistance during preliminary investigation and hearings. (Section 4, Rule I, Part V, Ibid.).

SECTION 5.    Receiving Complaints for Illegal Recruitment. â€” Victims of illegal recruitment and related cases may file with the Administration a report or complaint in writing and under oath for assistance purposes.
In regions outside the National Capital Region, complaints and reports involving illegal recruitment may be filed with the appropriate regional office of the Administration or the Department. (Section 5, Rule I, Part V, Ibid.).

SECTION 6.    Action on the Complaint/Report. â€” Where the complaint/report alleges that illegal recruitment activities are on-going, surveillance shall be conducted. If illegal recruitment activities are confirmed, issuance of closure order may be recommended to the Administrator through the Director of the Licensing and Regulation Office (Director-LRO).

If sufficient basis for criminal action is found, the case shall be immediately forwarded to the appropriate office for such action. (Section 6, Rule I, Part V, Ibid.).

SECTION 7.    Surveillance. â€” The Administrator and/or designated official in the DOLE regional offices may, on his own initiative, conduct surveillance on the alleged illegal recruitment activities.

Within two (2) days from the termination of surveillance, a report supported by an affidavit, shall be submitted to the Director-LRO or the Regional Director concerned as the case may be. (Section 7, Rule I, Part V, Ibid.).

SECTION 8.    Issuance of Closure Order. â€” The Secretary or the Administrator or the DOLE Regional Director of the appropriate regional office outside the National Capital Region, or their duly authorized representatives may conduct an ex-parte preliminary examination to determine whether the activities of a non-licensee constitute a danger to national security and public order or will lead to further exploitation of job seekers. For this purpose, the Secretary, Administrator or Regional Director concerned or their duly authorized representatives, may examine personally the complainants and/or their witnesses in the form of searching questions and answers and shall take their testimony under oath. The testimony of the complainant/s and/or witnesses shall be reduced in writing and signed by them.

If upon preliminary examination or surveillance, the Secretary, Administrator or DOLE Regional Director is satisfied that such danger or exploitation exists, a written order may be issued for the closure of the establishment being used for illegal recruitment activity.

In case of a business establishment whose license or permit to operate a business was issued by the local government, the Secretary, Administrator or Regional Director concerned shall likewise recommend to the granting authority the immediate cancellation/revocation of the license or permit to operate its business. (Section 8, Rule I, Part V, Ibid.).

SECTION 9.    Implementation of Closure Order. â€” Closure order shall be served upon the offender or the person in charge of the establishment subject thereof. The closure shall be effected by sealing the establishment and posting a notice of such closure in bold letters in a conspicuous place in the premises of the establishment. Whenever necessary, the assistance and support of the appropriate law enforcement agencies may be requested for this purpose. (Section 9, Rule I, Part V, Ibid.).

SECTION 10.    Report on Implementation. â€” A report on the implementation of the closure order executed under oath, stating the details of the proceedings undertaken shall be submitted to the Director-LRO or the Regional Director concerned, as the case may be, within two (2) days from the date of implementation. (Section 10, Rule I, Part V, Ibid.).

SECTION 11.    Institution of Criminal Action. â€” The Secretary, Administrator or the Regional Director concerned, or their duly authorized representatives or any aggrieved person, may initiate the corresponding criminal action with the appropriate office.
Where a complaint is filed with the Administration and the same is proper for preliminary investigation, it shall file the corresponding complaint with the appropriate officer, with the supporting documents. (Section 11, Rule I, Part V, Ibid.).

SECTION 12.    Motion to Lift a Closure Order. â€” A motion to lift a closure order which has already been implemented may be entertained only when filed with the LRO within ten (10) calendar days from the date of implementation thereof. The motion shall clearly state the grounds upon which it is based, attaching thereto the documents in support thereof. A motion to lift which does not conform with the requirements herein set forth shall be denied. (Section 12, Rule I, Part V, Ibid.).

SECTION 13.    Who May File. â€” The motion to lift a closure order may be filed only by the following:cralaw

a.    Owner of the building or his duly authorized representative;chanroblesvirtualawlibrary

b.    Building administrator or his duly authorized representative;chanroblesvirtualawlibrary

c.    The person or entity against whom the closure order was issued and implemented or the duly authorized representative; or

d.    Any other person or entity legitimately operating within the same premises closed/padlocked whose operations/activities are distinct from the recruitment activities of the person/entity subject of the closure order. (Section 13, Rule I, Part V, Ibid.).

SECTION 14.    Grounds for Lifting/Re-Opening. â€” Lifting of the closure order and/or reopening of the office closed or padlocked may be granted on any of the following grounds:cralaw

a.    That the office is not the subject of the closure order;chanroblesvirtualawlibrary

b.    That the contract of lease with the owner of the building or the building administrator has already been cancelled or terminated. The request to re-open shall be duly supported by an affidavit of undertaking either of the owner of the building or the building administrator that the same will not be leased/rented to any other person/entity for recruitment purposes without the necessary license from POEA;chanroblesvirtualawlibrary

c.    That the office is shared by a person/entity not involved in illegal recruitment activities, whether directly or indirectly; or

d.    Any other ground that the POEA may consider as valid and meritorious.

Lifting of a closure order is without prejudice to the filing of a criminal complaint with the appropriate office against the person alleged to have conducted illegal recruitment activities. (Section 14, Rule I, Part V, Ibid.).

SECTION 15.    Appeal. â€” The order of the Administrator denying the motion to lift may be appealed to the Secretary within ten (10) calendar days from the service of receipt hereof. (Section 15, Rule I, Part V, Ibid.).

SECTION 16.    Re-Padlocking of Office. â€” Where a re-opened office is subsequently confirmed to be used for illegal recruitment activities, a new closure order shall be issued which shall no longer be subject to a motion to lift. (Section 16, Rule I, Part V, Ibid.).

RULE II
Recruitment Violations and Related Cases

SECTION 1.    Jurisdiction. â€” The Administration shall exercise original and exclusive jurisdiction to hear and decide all cases which are administrative in character, involving or arising out of violation of recruitment laws, rules and regulations or violation of the conditions for issuance of license to recruit seafarers, including refund of fees collected from seafarers. (Section 1, Rule II, Part V, Ibid.).

SECTION 2.    Grounds for imposition of administrative sanctions:cralaw

a.    Charging, imposing or accepting directly or indirectly, any amount of money goods or services, or any fee or bond for any purpose from an applicant seafarer;chanroblesvirtualawlibrary

b.    Engaging in acts of misrepresentation, such as furnishing or publishing any false or deceptive notices or information in connection with the recruitment and employment of seafarers;chanroblesvirtualawlibrary

c.    Inducing or attempting to induce an already employed seafarer to transfer from or leave his employment for another unless the transfer is designed to liberate the seafarer from oppressive terms and conditions or employment;chanroblesvirtualawlibrary

d.    Influencing or attempting to influence any person or entity not to employ any seafarer who has not applied for employment through his agency;chanroblesvirtualawlibrary

e.    Obstructing or attempting to obstruct inspection by the Secretary, the Administrator or their duly authorized representatives;chanroblesvirtualawlibrary

f.    Substituting or altering to the prejudice of the seafarer employment contracts and other documents approved and verified by the Department from the time of actual signing thereof by the parties up to and including the period of expiration of the same without the Department's approval;chanroblesvirtualawlibrary

g.    Failure to submit reports related to overseas recruitment and employment within the specified time, as may be required by the Secretary or the Administration;chanroblesvirtualawlibrary

h.    For the owner, partner, or officer/s of any licensed agency to become an officer or member of the Board of any corporation or partnership engaged directly or indirectly in the management of a travel agency;chanroblesvirtualawlibrary

i.    Withholding or denying travel or other pertinent documents from seafarers for reasons other than those authorized under existing laws and its implementing rules and regulations;chanroblesvirtualawlibrary

j.    Engaging in recruitment activities in places other than that specified in the license without previous authorization from the Administration;chanroblesvirtualawlibrary

k.    Appointing or designating agents, representatives or employees without prior approval from the Administration;chanroblesvirtualawlibrary

l.    Falsifying or altering travel documents of applicant seafarer;chanroblesvirtualawlibrary

m.    Deploying seafarers whose employment and travel documents were not processed by the Administration or those agencies authorized by it;chanroblesvirtualawlibrary

n.    Deploying seafarers to principals not accredited by the Administration or to vessels not enrolled with the deploying agency;chanroblesvirtualawlibrary

o.    Failure to deploy a seafarer within the prescribed period without valid reason;chanroblesvirtualawlibrary

p.    Disregard of lawful orders, notices and other processes issued by the Administration;chanroblesvirtualawlibrary

q.    Coercing a seafarer to accept prejudicial arrangements in exchange for certain benefits that rightfully belong to the seafarer;chanroblesvirtualawlibrary

r.    Withholding of seafarers' salaries or remittances without justifiable reasons or shortchanging of remittances;chanroblesvirtualawlibrary

s.    Engaging in act/s of misrepresentation for the purpose of securing a license or renewal thereof, such as giving false testimonies or information or falsified documents;chanroblesvirtualawlibrary

t.    Engaging in the recruitment or deployment of seafarers in jobs harmful to public health or morality or to dignity of the Republic of the Philippines;chanroblesvirtualawlibrary

u.    Allowing persons who are otherwise disqualified to participate in the overseas employment program under existing laws, rules and regulations to participate in the management and operation of the agency;chanroblesvirtualawlibrary

v.    Transfer or change of ownership of a single proprietorship licensed to engage in overseas employment;chanroblesvirtualawlibrary

w.    Failure to comply with its undertaking to provide Pre-Departure Orientation Seminar to its seafarers;chanroblesvirtualawlibrary

x.    Failure to comply with the undertaking to deploy the required number of seafarers within the period, provided in these Rules;chanroblesvirtualawlibrary

y.    Non-compliance with any other undertaking in connection with the issuance or renewal of the license;chanroblesvirtualawlibrary

z.    Failure to reimburse expenses incurred by the seafarer in connection with his documentation and processing for purposes of deployment, where deployment does not take place without the seafarer's fault; and

aa.    Violation of other pertinent provisions of the Code and other relevant laws, rules and regulations, guidelines and other issuance on recruitment and deployment of seafarers for overseas employment and the protection of their welfare. (Section 2, Rule II, Part V, Ibid.).

RULE III
Filing of Complaints

SECTION 1.    Who May File a Complaint. â€” Any aggrieved person may file a complaint in writing and under oath for violation of the provisions of the Labor Code, POEA rules and regulations and other issuances relating to recruitment.

For this purpose, an aggrieved person is one who is prejudiced by the commission of a violation.

However, the Administration, on its own initiative, may conduct proceedings based on reports of violation of the Labor Code, these rules and other issuances, subject to preliminary evaluation. (Section 1, Rule III, Part V, Ibid.).

SECTION 2.    Venue. â€” Any complaint arising out of recruitment violation or violation of the conditions of license may be filed with the Adjudication Office of this Administration or in the nearest POEA Regional Centers/Extension Units or the DOLE Regional Office exercising territorial jurisdiction over the place where the complainant was recruited at the option of the complainant. The office to which complaint was first filed shall take cognizance of the case.

Where the complainant was recruited within the National Capital Region, the complaint shall be filed with the Adjudication Office of the Administration.

In the case of reports received by the Administration, the same shall be investigated by the Adjudication Office, this Administration or at the appropriate Regional Office/POEA Regional Center/Extension Unit.

However, the venue of cases filed with the Adjudication Office may be transferred to the Regional Office/POEA Regional Center/Extension Unit before the respondent files its answer and upon request of either party and upon approval by the Administration.

For purpose of hearing and receiving of evidence, the DOLE Regional Office exercising territorial jurisdiction over the place where the complainant was recruited may be deputized by the Secretary of Labor to take cognizance of the case for submission of its findings and recommendations to the Administrator. (Section 2, Rule III, Part V, Ibid.).

SECTION 3.    Contents of Complaint. â€” All complaints must contain, among others, the following:cralaw

a.    The name/s and address/es of the complainants;
b.    The name/s and address/es of the respondents;
c.    The nature of the complaint;
d.    The substance, cause/grounds of the complaint;
e.    When and where the action complained of happened;
f.    The amount of claim, if any;
g.    The relief/s sought.

The complaint shall be under oath and shall, whenever possible, be accompanied by supporting documents, together with a certificate of non-forum shopping. (Section 3, Rule III, Part V, Ibid.).

SECTION 4.    Docket and Assignment of Cases. â€” Complaints duly received shall be docketed and raffled for investigation and hearing. (Section 4, Rule III, Part V, Ibid.).

RULE IV
Action upon Complaint

SECTION 1.    Answer. â€” Upon receipt of the complaint, the Administration shall issue an order, attaching thereto a copy of the complaint and supporting documents, if any, directing the respondents to file a verified Answer and not a Motion to Dismiss within ten (10) calendar days from receipt, attaching proof that a copy was sent to the complainant. (Section 1, Rule IV, Part V, Ibid.).

SECTION 2.    Failure to File Answer. â€” In case of failure to file Answer, the investigation/hearing shall proceed ex-parte.

An Answer filed out of time shall not be admitted except on meritorious grounds and upon motion. (Section 2, Rule IV, Part V, Ibid.).

SECTION 3.    Motion for Extension. â€” Only one motion for extension of time to file Answer shall be allowed. The Overseas Employment Adjudicator, upon receipt of such motion, may, upon meritorious grounds, grant a non-extendible period of ten (10) calendar days, except where allegations in the complaint refer to facts or circumstances which occurred abroad making it necessary to verify with the concerned foreign principal, a longer period may be granted. A ruling on the motion may be made by the Overseas Employment Adjudicator during the proceedings and entered in the minutes or sent by personal service or by registered mail. (Section 3, Rule IV, Part V, Ibid.).

SECTION 4.    Proof and Completeness of Service. â€” The contents of the return shall be proof of the facts stated therein. Service by registered mail is complete upon receipt by the addressee or agent; but if the addressee or agent fails to claim his mail from the postmaster, service shall take effect after the date of the last notice. Where the present location of the addressee is unknown, service made at the last known address shall be sufficient. (Section 4, Rule IV, Part V, Ibid.).

Personal service made to any officer or personnel of the manning agency shall likewise be sufficient.

SECTION 5.    Nature of Proceedings. â€” The proceedings shall comply with the requirements of due process without strictly adhering to the technicalities of procedure and evidence applicable to judicial proceedings. The Overseas Employment Adjudicator may avail himself of reasonable means to ascertain the facts of the case. (Section 5, Rule IV, Part V, Ibid.).

SECTION 6.    Preliminary Hearing. â€” The Overseas Employment Adjudicator shall set the date, time and place of the preliminary hearing with due notice to the parties with the end view of arriving at an amicable settlement and for purposes of simplifying the issues, marking of evidence and stipulation of facts. (Section 6, Rule IV, Part V, Ibid.).

SECTION 7.    Clarificatory Questions. â€” At any stage of the proceedings and prior to the submission by the parties of the case for resolution, the Overseas Employment Adjudicator may initiate clarificatory questions to the parties or their witnesses to further elicit relevant facts or information.

The Overseas Employment Adjudicator may set a hearing where the parties shall be given an opportunity to be present but without right to examine or cross-examine. If the parties so desire, they may submit questions to the Overseas Employment Adjudicator who may ask the question to the parties or witnesses concerned. (Section 7, Rule IV, Part V, Ibid.).

SECTION 8.    Service of Order to Appear/To Produce Documents. â€” The Administration shall issue an order to appear/to produce documents. The process server who personally served the order to appear/to produce documents, notice order, resolution or decision shall submit his return within five (5) calendar days from the date of his service thereof, stating legibly in his return his name, the mode/s of service, the name/s of the other person/s served and the date/s of receipt. If no service was effected, the serving officer shall state the reason therefore. The return shall form part of the records of the case. (Section 8, Rule IV, Part V, Ibid.).

SECTION 9.    Failure or Refusal to Obey Order To Appear/To Produce Documents. â€” The license of an agency whose officers or employers fail or refuse to comply with an order to appear/to produce documents without justifiable reason shall be suspended until otherwise lifted. This is without prejudice to the outcome of the investigation where the proper penalty may be imposed. (Section 9, Rule IV, Part V, Ibid.).

SECTION 10.    Summary Judgment. â€” Should the Overseas Employment Adjudicator find, upon consideration of the complaint, answer and evidence submitted, that resolution/decision may be rendered, the case shall be deemed submitted and a summary judgment shall by issued. (Section 10, Rule IV, Part V, Ibid.).

SECTION 11.    Effects of Withdrawal of Complaint/Desistance. â€” The withdrawal/desistance of the complaining witness shall not bar the Administration from proceeding with the investigation of the recruitment violation/s. The Administration shall resolve the case on the merits and impose the appropriate penalties. (Section 11, Rule IV, Part V, Ibid.).

SECTION 12.    Resolution of the Case. â€” Except in cases of preventive suspension, the Overseas Employment Adjudicator shall, within ninety (90) calendar days from the filing of the case, submit his findings and recommendations in the form of a draft order. (Section 12, Rule IV, Part V, Ibid.).

SECTION 13.    Who May Issue Orders/Resolutions. â€” The Administrator may issue orders of reprimand, suspension of documentary processing, suspension, cancellation or revocation of license, or dismissal on the merits of the case.

All other orders or resolutions shall be signed by the Director of the Adjudication Office. (Section 13, Rule IV, Part V, Ibid.).

SECTION 14.    Contents of Orders/Resolutions. â€” Orders/Resolutions issued by the Administration shall be clear and concise and shall include a brief statement of the following:cralaw

a.    Facts of the case;
b.    Issue/s involved;
c.    Applicable laws/s or rule/s;
d.    Conclusions and reasons therefore; and
e.    Specific remedy/ies or relief/s granted or imposable sanction/s. (Section 14, Rule IV, Part V, Ibid.).

SECTION 15.    Suspension of Documentary Processing. â€” The Administration may order the suspension of the processing of documents of a respondent agency for violation of any provision of these Rules, POEA Orders and other issuances. This is without prejudice to the outcome of the investigation wherein the proper penalty may be imposed. (Section 15, Rule IV, Part V, Ibid.).

SECTION 16.    Preventive Suspension. â€” Pending investigation of the recruitment violation/s, the license of the respondent agency may be suspended for a period not exceeding the imposable penalties under the revised schedule of penalties, on the following grounds:cralaw

a.    There exist reasonable grounds to believe that the continued operation of the agency will lead to further violation or exploitation of the workers being recruited or adversely affect friendly relations with any country or otherwise prejudice national interest; and

b.    There is a prima facie evidence of a case for violation of the pertinent provisions of the Labor Code, its implementing rules and regulations, POEA Rules and Regulations or any issuance of the Administration, where the evidence of guilt is strong.

The Administrator may issue an order lifting or modifying the order of preventive suspension as the circumstances may warrant. Where an Order of Preventive Suspension is issued by the Administration, the Overseas Employment Adjudicator shall, within sixty (60) calendar days from filling of the case, submit his findings and recommendation in the form of a draft order. (Section 16, Rule IV, Part V, Ibid.).

SECTION 17.    Effects of Orders of Suspension, Revocation or Cancellation of License. â€” An order of suspension, cancellation or revocation of license shall have the effect of suspending or terminating all activities of the agency which fall under the definition of recruitment and placement. (Section 17, Rule IV, Part V, Ibid.).

SECTION 18.    Fines. â€” The Administrator may also impose additional fines for failure to comply with a final order. (Section 18, Rule IV, Part V, Ibid.).

RULE V
Classification of Offenses and Schedule of Penalties

SECTION 1.    Classification of Offenses. â€” Administrative offenses are classified into serious, less serious and light, depending on their gravity. The Administration shall impose the appropriate administrative penalties for every recruitment violation.

A.    The following are serious offenses with their corresponding penalties:cralaw

1.    Engaging in act/s of misrepresentation for the purpose of securing a license or renewal thereof, such as giving false information or documents

1st Offense â€” Cancellation of License

2.    Engaging in the recruitment or placement of seafarers in jobs harmful to public health or morality or to dignity of the Republic of the Philippines

1st Offense â€” Cancellation of License

3.    Transfer or change of ownership of a single proprietorship licensed to engage in overseas employment

1st Offense â€” Cancellation of License

4.    Charging or accepting directly or indirectly any amount of money, goods or services, or any fee or bond for any purpose from the seafarers

1st Offense â€” Cancellation of License

The penalty shall carry the accessory penalty of refund of the fee charged or collected from the worker.

B.    The following are less serious offenses with their corresponding penalties:cralaw

1.    Engaging in acts of misrepresentation in connection with recruitment and placement of seafarers, such as furnishing or publishing any false notice, information or document in relation to recruitment or employment

1st Offense â€” Suspension of License (Two Months to Six Months)

